{
  "build_number": "0054",
  "created_at": "2026-07-23T08:00:00Z",
  "created_by": "Certiaura Governance",
  "peptide_uai": "CERT-PKS-000001",
  "record_type": "operational_assurance_assessment",
  "assessment_id": "RET-OAA-0054-001",
  "coverage_domains": [
    "evidence",
    "biology",
    "safety",
    "monitoring",
    "reporting",
    "clinician handoff",
    "knowledge change",
    "publication",
    "audit",
    "rollback"
  ],
  "end_to_end_workflows": [
    {
      "workflow_id": "RET-E2E-001",
      "start": "signal detection",
      "end": "post-change effectiveness review",
      "status": "PASS",
      "evidence_links": [
        "Documentation/Build_Records/0054/REAL_WORLD_OPERATOR_WORKFLOW_REGRESSION_REPORT.json"
      ]
    }
  ],
  "open_critical_gaps": [],
  "overall_result": "PASS",
  "human_approver": "Founder governance reviewer"
}
